{
  "$schema": "https://json-schema.org/draft/2020-12/schema",
  "$id": "https://ita.local/contracts/agent/student-tutor-agent-readonly-adapter.schema.json",
  "title": "StudentTutorAgent Read-Only Adapter",
  "type": "object",
  "additionalProperties": false,
  "required": [
    "schemaVersion",
    "adapterId",
    "workerAgent",
    "skillId",
    "routeMode",
    "readPort",
    "inputSchemaRef",
    "outputSchemaRef",
    "guards",
    "evidence",
    "slo",
    "promotion"
  ],
  "properties": {
    "schemaVersion": {
      "type": "string",
      "const": "2026-06-04.agent.student-tutor-readonly-adapter.v1"
    },
    "adapterId": { "type": "string", "const": "student_tutor_recommend_practice_readonly_adapter" },
    "workerAgent": { "type": "string", "const": "StudentTutorAgent" },
    "skillId": { "type": "string", "const": "recommend_practice" },
    "routeMode": { "type": "string", "const": "SINGLE_WORKER" },
    "inputSchemaRef": {
      "type": "string",
      "const": "contracts/agent/skills/recommend-practice.input.schema.json"
    },
    "outputSchemaRef": {
      "type": "string",
      "const": "contracts/agent/skills/recommend-practice.output.schema.json"
    },
    "readPort": {
      "type": "object",
      "additionalProperties": false,
      "required": [
        "portName",
        "operation",
        "transport",
        "directDatabaseAccessAllowed",
        "writeOperationAllowed"
      ],
      "properties": {
        "portName": { "type": "string", "const": "StudentLearningReadPort" },
        "operation": { "type": "string", "const": "recommendPracticeContext" },
        "transport": { "type": "string", "enum": ["HTTP", "IN_PROCESS"] },
        "directDatabaseAccessAllowed": { "type": "boolean", "const": false },
        "writeOperationAllowed": { "type": "boolean", "const": false }
      }
    },
    "guards": {
      "type": "object",
      "additionalProperties": false,
      "required": [
        "principalContextRequired",
        "sharedContextRequired",
        "guardrailResultRequired",
        "denyOnWriteIntent",
        "denyOnCrossStudentAccess",
        "denyOnRawStudentArchiveReturn",
        "denyOnFinalEvaluation",
        "denyOnExternalModelRequest",
        "denyOnLocalToolMutation",
        "dataScopes"
      ],
      "properties": {
        "principalContextRequired": { "type": "boolean", "const": true },
        "sharedContextRequired": { "type": "boolean", "const": true },
        "guardrailResultRequired": { "type": "boolean", "const": true },
        "denyOnWriteIntent": { "type": "boolean", "const": true },
        "denyOnCrossStudentAccess": { "type": "boolean", "const": true },
        "denyOnRawStudentArchiveReturn": { "type": "boolean", "const": true },
        "denyOnFinalEvaluation": { "type": "boolean", "const": true },
        "denyOnExternalModelRequest": { "type": "boolean", "const": true },
        "denyOnLocalToolMutation": { "type": "boolean", "const": true },
        "dataScopes": {
          "type": "object",
          "additionalProperties": false,
          "required": ["knowledge", "student", "teaching", "research", "localTool"],
          "properties": {
            "knowledge": { "type": "string", "const": "PUBLIC" },
            "student": { "type": "string", "const": "ASSIGNED" },
            "teaching": { "type": "string", "const": "READ" },
            "research": { "type": "string", "const": "NONE" },
            "localTool": { "type": "string", "const": "NONE" }
          }
        }
      }
    },
    "evidence": {
      "type": "object",
      "additionalProperties": false,
      "required": [
        "skillInvocationTraceRequired",
        "inputHashRequired",
        "outputSummaryRequired",
        "sourceEvidenceRefsRequired",
        "studentScopeEvidenceRequired",
        "runtimeTimingRequired"
      ],
      "properties": {
        "skillInvocationTraceRequired": { "type": "boolean", "const": true },
        "inputHashRequired": { "type": "boolean", "const": true },
        "outputSummaryRequired": { "type": "boolean", "const": true },
        "sourceEvidenceRefsRequired": { "type": "boolean", "const": true },
        "studentScopeEvidenceRequired": { "type": "boolean", "const": true },
        "runtimeTimingRequired": { "type": "boolean", "const": true }
      }
    },
    "slo": {
      "type": "object",
      "additionalProperties": false,
      "required": ["p99BudgetMs", "maxRecommendations", "maxReasonChars"],
      "properties": {
        "p99BudgetMs": { "type": "integer", "minimum": 1, "maximum": 50 },
        "maxRecommendations": { "type": "integer", "minimum": 1, "maximum": 10 },
        "maxReasonChars": { "type": "integer", "minimum": 1, "maximum": 500 }
      }
    },
    "promotion": {
      "type": "object",
      "additionalProperties": false,
      "required": [
        "currentEvidenceClass",
        "runtimeEvidenceRequiredBeforePromotion",
        "rootWorkflowRequired"
      ],
      "properties": {
        "currentEvidenceClass": { "type": "string", "const": "CONTRACT_ONLY" },
        "runtimeEvidenceRequiredBeforePromotion": { "type": "boolean", "const": true },
        "rootWorkflowRequired": { "type": "boolean", "const": true }
      }
    }
  }
}
